{
  "mode": "instant",
  "owner": {
    "github": "wolfiku"
  },
  "page": {
    "type": "person",
    "title": "Wolfiku",
    "theme": "plum",
    "tagline": "im a small open soruce software builder from germany",
    "links": [
      {
        "label": "Wolfiku Gaming",
        "url": "https://gaming.wolfiku.net"
      },
      {
        "label": "Main website",
        "url": "https://wolfiku.de"
      },
      {
        "label": "GitHub",
        "url": "https://github.com/wolfiku"
      },
      {
        "label": "Scoodol",
        "url": "https://scoodol.app"
      }
    ],
    "sections": [
      {
        "heading": "About",
        "text": "Hi, I'm Wolfiku. I build and run my own little corner of the internet: from the Wolfiku Gaming Minecraft network to web apps, tools and the infrastructure behind them. Everything here is self-made and self-hosted, built out of curiosity and the fun of making things work."
      }
    ]
  },
  "showcase": true
}
